{
  "$schema": "https://json-schema.org/draft/2020-12/schema",
  "$id": "cursor-protocol.schema.json",
  "title": "Cursor ACP vocabulary and launch settings",
  "type": "object",
  "additionalProperties": false,
  "required": [
    "_readme",
    "options",
    "toolNames",
    "methods",
    "supplement",
    "storedTool",
    "storedBlock",
    "blockTypes",
    "extensionFrame"
  ],
  "$defs": {
    "table": {
      "type": "object",
      "minProperties": 1,
      "propertyNames": {
        "pattern": "^[A-Z][A-Za-z0-9]*$"
      },
      "additionalProperties": {
        "type": "string",
        "minLength": 1
      }
    },
    "structs": {
      "description": "Go structs generated from this domain. Each states its field list once and takes every json tag from a named table, so a rename in the table reaches the struct.",
      "type": "object",
      "minProperties": 1,
      "propertyNames": {
        "pattern": "^[A-Z][A-Za-z0-9]*$"
      },
      "additionalProperties": {
        "type": "object",
        "additionalProperties": false,
        "required": [
          "table",
          "fields"
        ],
        "properties": {
          "doc": {
            "type": "string",
            "minLength": 1
          },
          "table": {
            "type": "string",
            "minLength": 1
          },
          "fields": {
            "type": "array",
            "minItems": 1,
            "items": {
              "type": "object",
              "additionalProperties": false,
              "required": [
                "key",
                "type"
              ],
              "properties": {
                "key": {
                  "type": "string",
                  "pattern": "^[A-Z][A-Za-z0-9]*$"
                },
                "type": {
                  "type": "string",
                  "minLength": 1
                },
                "omitempty": {
                  "type": "boolean"
                },
                "table": {
                  "type": "string",
                  "minLength": 1
                }
              }
            }
          }
        }
      }
    },
    "unread": {
      "description": "The per-key exemptions this domain states. `contractsAreConsumed.test.mjs` holds every KEY of a table to a reader on each side the table declares. A key one side genuinely never reads states that here: `_unread.<table>.<Key>.sides` lists the sides that skip it, and `.why` says what reads it instead. The key stays in the contract, because the other side still reads it and a rename must still reach that side. An exemption the code no longer needs fails the same test, so a stale one cannot survive.",
      "type": "object",
      "minProperties": 1,
      "additionalProperties": {
        "type": "object",
        "minProperties": 1,
        "propertyNames": {
          "pattern": "^[A-Z][A-Za-z0-9]*$"
        },
        "additionalProperties": {
          "type": "object",
          "additionalProperties": false,
          "required": [
            "sides",
            "why"
          ],
          "properties": {
            "sides": {
              "type": "array",
              "minItems": 1,
              "uniqueItems": true,
              "items": {
                "enum": [
                  "go",
                  "ts"
                ]
              }
            },
            "why": {
              "type": "string",
              "minLength": 31
            }
          }
        }
      }
    }
  },
  "properties": {
    "_readme": {
      "type": "string",
      "minLength": 1
    },
    "_unread": {
      "$ref": "#/$defs/unread"
    },
    "toolNames": {
      "$ref": "#/$defs/table"
    },
    "methods": {
      "$ref": "#/$defs/table"
    },
    "supplement": {
      "$ref": "#/$defs/table"
    },
    "storedTool": {
      "$ref": "#/$defs/table"
    },
    "storedBlock": {
      "$ref": "#/$defs/table"
    },
    "blockTypes": {
      "$ref": "#/$defs/table"
    },
    "extensionFrame": {
      "$ref": "#/$defs/table"
    },
    "structs": {
      "$ref": "#/$defs/structs"
    },
    "options": {
      "$ref": "#/$defs/table"
    }
  }
}
